{
  "ruleset_version": "2026.10.19.4",
  "generated_at": "2026-10-19T07:29:56Z",
  "schema_version": "1",
  "min_client_version": "0.1.0",
  "holidays": {
    "cn": {
      "source": "https://github.com/NateScarlet/holiday-cn",
      "updated_at": "2026-10-19",
      "days": [
        "2026-01-01",
        "2026-01-02",
        "2026-01-03",
        "2026-02-15",
        "2026-02-16",
        "2026-02-17",
        "2026-02-18",
        "2026-02-19",
        "2026-02-20",
        "2026-02-21",
        "2026-02-22",
        "2026-02-23",
        "2026-04-04",
        "2026-04-05",
        "2026-04-06",
        "2026-05-01",
        "2026-05-02",
        "2026-05-03",
        "2026-05-04",
        "2026-05-05",
        "2026-06-19",
        "2026-06-20",
        "2026-06-21",
        "2026-09-25",
        "2026-09-26",
        "2026-09-27",
        "2026-10-01",
        "2026-10-02",
        "2026-10-03",
        "2026-10-04",
        "2026-10-05",
        "2026-10-06",
        "2026-10-07"
      ]
    }
  },
  "providers": [
    {
      "id": "claude",
      "name": "Claude Code（Pro / Max）",
      "kind": "subscription",
      "homepage": "https://claude.ai",
      "sources": [
        "https://support.claude.com/en/articles/11145838-using-claude-code-with-your-pro-or-max-plan",
        "https://code.claude.com/docs/en/costs",
        "https://www.anthropic.com/news/higher-limits-spacex（取消高峰降额的公告）"
      ],
      "confidence": "community",
      "verified_at": "2026-10-19",
      "tags": [
        "subscription",
        "oauth",
        "requires-web-login",
        "peak-deprecated"
      ],
      "notes": [
        "窗口规则有官方文档，OAuth 用量接口未公开文档（社区长期使用）。",
        "**需要 OAuth 登录**：token 需带 user:profile scope；桌面端凭据在 Keychain（Claude Code-credentials）或 ~/.claude/.credentials.json。",
        "字段路径来自社区实现，接入前务必实测（可能存在 utilization / resets_at 之类的变体）。"
      ],
      "auth": {
        "type": "oauth",
        "header": "Authorization",
        "prefix": "Bearer ",
        "key_hint": "Claude Code OAuth access token"
      },
      "regions": [
        {
          "id": "default",
          "label": "默认",
          "base": "https://api.anthropic.com"
        }
      ],
      "queries": [
        {
          "id": "oauth_usage",
          "label": "订阅额度窗口",
          "method": "GET",
          "region": "default",
          "path": "/api/oauth/usage",
          "extra_headers": {
            "anthropic-beta": "oauth-2025-04-20"
          },
          "values": [
            {
              "id": "five_hour",
              "label": "5 小时窗口",
              "from": "five_hour.utilization",
              "unit": "percent",
              "reset_from": "five_hour.resets_at"
            },
            {
              "id": "seven_day",
              "label": "周窗口",
              "from": "seven_day.utilization",
              "unit": "percent",
              "reset_from": "seven_day.resets_at"
            },
            {
              "id": "seven_day_sonnet",
              "label": "Sonnet 周窗口",
              "from": "seven_day_sonnet.utilization",
              "unit": "percent"
            },
            {
              "id": "seven_day_opus",
              "label": "Opus 周窗口",
              "from": "seven_day_opus.utilization",
              "unit": "percent"
            }
          ],
          "note": "同一响应可能还带 limits[].weekly_scoped（模型级周窗）。客户端应容忍字段缺失。"
        },
        {
          "id": "oauth_profile",
          "label": "账号校验",
          "method": "GET",
          "region": "default",
          "path": "/api/oauth/profile",
          "values": [
            {
              "id": "plan",
              "label": "套餐",
              "from": "organization.plan_type",
              "unit": "string"
            }
          ],
          "note": "用于校验 token 有效性，字段名以实测为准。"
        }
      ],
      "peak": {
        "has_peak": true,
        "schedule_known": true,
        "enabled": false,
        "timezone": "America/Los_Angeles",
        "windows": [
          {
            "days": [
              1,
              2,
              3,
              4,
              5
            ],
            "start": "05:00",
            "end": "11:00"
          }
        ],
        "applies_to": "plan_quota",
        "note": "历史规则（2026-03-23 生效）：周一至周五 05:00-11:00 PT 为高峰，5 小时窗口消耗更快；官方已于 2026-05-06 取消高峰降额并翻倍 5 小时限额，故 enabled=false，保留供历史回放。"
      }
    },
    {
      "id": "clinepass",
      "name": "ClinePass",
      "kind": "subscription",
      "homepage": "https://cline.bot",
      "sources": [
        "https://github.com/VicBilibily/GCMP/blob/main/src/quota/providers/clinepass.ts",
        "https://github.com/steipete/CodexBar/blob/main/docs/clinepass.md"
      ],
      "confidence": "community",
      "verified_at": "2026-10-19",
      "tags": [
        "subscription",
        "coding-plan",
        "peak-pricing"
      ],
      "notes": [
        "官方文档只在控制台展示用量，未公开该端点；≥4 个独立实现（GCMP / CodexBar / OmniRoute / oh-my-pi）字段一致。",
        "API Key 即可查询，无需内嵌浏览器；另有 Cline CLI 的 WorkOS OAuth 会话可作替代凭据。",
        "limit 类型以 type 字段区分，不要按下标取。"
      ],
      "auth": {
        "type": "bearer",
        "header": "Authorization",
        "prefix": "Bearer ",
        "key_hint": "Cline / ClinePass API Key"
      },
      "regions": [
        {
          "id": "default",
          "label": "默认",
          "base": "https://api.cline.bot"
        }
      ],
      "queries": [
        {
          "id": "usage_limits",
          "label": "套餐限频",
          "method": "GET",
          "region": "default",
          "path": "/api/v1/users/me/plan/usage-limits",
          "values": [
            {
              "id": "success",
              "label": "业务成功标志",
              "from": "success",
              "unit": "bool"
            },
            {
              "id": "five_hour",
              "label": "5 小时窗口已用",
              "from": "data.limits[].percentUsed",
              "unit": "percent",
              "reset_from": "data.limits[].resetsAt",
              "note": "按同一元素的 type 字段筛选（five_hour / weekly / monthly）；`[]` 表示逐项展开"
            }
          ],
          "note": "成功判据为 success=true（不是 HTTP 状态码）。"
        }
      ],
      "peak": {
        "has_peak": true,
        "schedule_known": true,
        "timezone": "Asia/Shanghai",
        "windows": [
          {
            "days": [
              1,
              2,
              3,
              4,
              5
            ],
            "start": "09:00",
            "end": "12:00"
          },
          {
            "days": [
              1,
              2,
              3,
              4,
              5
            ],
            "start": "14:00",
            "end": "18:00"
          }
        ],
        "applies_to": "api_pricing",
        "note": "来源为 GCMP 的 tokenPricing.tiers cron（`* 9-11,14-17 * * 1-5`，分钟粒度右开区间，等价于上表），**官方未公布时段**，存疑。"
      }
    },
    {
      "id": "codex",
      "name": "Codex / ChatGPT 订阅",
      "kind": "subscription",
      "homepage": "https://chatgpt.com",
      "sources": [
        "https://github.com/openai/codex（官方 CLI 源码引用 {base}/wham/usage）",
        "https://help.openai.com/en/articles/11369540-using-codex-with-your-chatgpt-plan"
      ],
      "confidence": "community",
      "verified_at": "2026-10-19",
      "tags": [
        "subscription",
        "oauth",
        "requires-web-login"
      ],
      "notes": [
        "接口未公开文档，字段结构由官方开源仓库 openai/codex 的 backend-client 源码印证。",
        "**需要 OAuth 登录**：客户端必须自行完成 PKCE 授权流程（内嵌 Web 或外部浏览器回跳），请求需附加 chatgpt-account-id 头（取自 OAuth 会话）。",
        "桌面端凭据位于 ~/.codex/auth.json，可作为调试参照。"
      ],
      "auth": {
        "type": "oauth",
        "header": "Authorization",
        "prefix": "Bearer ",
        "key_hint": "ChatGPT OAuth access token"
      },
      "regions": [
        {
          "id": "default",
          "label": "默认",
          "base": "https://chatgpt.com"
        }
      ],
      "queries": [
        {
          "id": "wham_usage",
          "label": "订阅额度窗口",
          "method": "GET",
          "region": "default",
          "path": "/backend-api/wham/usage",
          "values": [
            {
              "id": "plan",
              "label": "套餐类型",
              "from": "plan_type",
              "unit": "string"
            },
            {
              "id": "primary",
              "label": "主窗口（通常 5 小时）已用",
              "from": "rate_limit.primary_window.used_percent",
              "unit": "percent",
              "reset_from": "rate_limit.primary_window.resets_at",
              "note": "配套字段 limit_window_seconds / reset_after_seconds 用于判读窗口长度"
            },
            {
              "id": "secondary",
              "label": "次窗口（通常周）已用",
              "from": "rate_limit.secondary_window.used_percent",
              "unit": "percent",
              "reset_from": "rate_limit.secondary_window.resets_at"
            },
            {
              "id": "credits",
              "label": "额外额度",
              "from": "credits",
              "unit": "string"
            }
          ]
        },
        {
          "id": "reset_credits",
          "label": "限额重置券",
          "method": "GET",
          "region": "default",
          "path": "/backend-api/wham/rate-limit-reset-credits",
          "values": [
            {
              "id": "available",
              "label": "可用重置券",
              "from": "available_count",
              "unit": "count"
            }
          ],
          "note": "字段名以实测为准（社区）。"
        }
      ],
      "peak": {
        "has_peak": false,
        "schedule_known": true,
        "note": "未找到峰谷规则：只有 5 小时/周窗口与重置券，无时段系数。"
      }
    },
    {
      "id": "commandcode",
      "name": "CommandCode（Go / GOAT）",
      "kind": "subscription",
      "homepage": "https://commandcode.ai",
      "sources": [
        "https://commandcode.ai/docs/plans/goat",
        "https://github.com/VicBilibily/GCMP（src/quota/providers/commandcode.ts）"
      ],